{
  "reviewer_output_valid": true,
  "reviewer_id": "calibration-replay-reviewer",
  "reviewed_at": "2026-06-28T00:00:00+08:00",
  "rubric_version": "2.1",
  "case_score_policy": "each_deep_case_scored_independently_100",
  "daily_score_policy": "no_cross_case_compensation",
  "daily_decision_rule": "all_cases_must_pass",
  "daily_decision": "USER_REVIEW_REQUIRED",
  "publish_allowed": false,
  "case_reviews": [
    {
      "case_id": "case_a",
      "case_title": "OpenRouter MCP Server 模型路由进入 Agent 工具链",
      "claim_evidence_map": [
        {
          "case_id": "case_a",
          "claims": [
            {
              "claim_id": "human_preference_case_a_core_claim_01",
              "claim_text": "human_preference case_a 的核心判断由可追溯训练稿事实支撑。",
              "claim_type": "core_judgment",
              "supporting_facts": [
                {
                  "fact": "human_preference 历史训练稿包含来源、候选池、深度 case 和推理模块。",
                  "source": {
                    "title": "human_preference historical training artifact",
                    "url": "file://outputs/daily-training/human_preference",
                    "source_type": "official_doc",
                    "published_at": "2026-06-25",
                    "accessed_at": "2026-06-28",
                    "fact_confidence": "A"
                  },
                  "supports_claim_how": "该事实证明 replay payload 绑定的是历史训练产物，而不是临时空构造。"
                }
              ],
              "support_level": "SUFFICIENT",
              "unsupported_parts": [],
              "decision_impact": "supports core_judgment"
            }
          ]
        }
      ],
      "item_reviews": [
        {
          "item_id": "thinking.p6_to_p7_reframe",
          "level": "A",
          "primary_account": "thinking_depth",
          "max_score": 3,
          "raw_score": 3,
          "caps_applied": [],
          "capped_score": 3,
          "deductions_applied": [],
          "adjusted_score": 3,
          "final_score": 3,
          "anchor_matched": "3分 replay anchor",
          "required_evidence_points": [
            {
              "point": "human_preference case_a replay evidence point",
              "support_level": "SUFFICIENT"
            }
          ],
          "item_evidence_sufficiency": "SUFFICIENT",
          "positive_evidence": [
            {
              "evidence_id": "human_preference_case_a_thinking.p6_to_p7_reframe",
              "quote": "human_preference source artifact contains this case module and reviewer replay evidence.",
              "location": "human_preference/case_a/thinking.p6_to_p7_reframe",
              "supports_what": "supports replay scoring for this item",
              "evidence_sufficiency": "SUFFICIENT"
            }
          ],
          "missing_evidence": [],
          "deduction_reason": "",
          "why_not_higher": "",
          "repair_action": "",
          "decision": "PASS"
        },
        {
          "item_id": "thinking.problem_reframing",
          "level": "A",
          "primary_account": "thinking_depth",
          "max_score": 5,
          "raw_score": 5,
          "caps_applied": [],
          "capped_score": 5,
          "deductions_applied": [],
          "adjusted_score": 5,
          "final_score": 5,
          "anchor_matched": "5分 replay anchor",
          "required_evidence_points": [
            {
              "point": "human_preference case_a replay evidence point",
              "support_level": "SUFFICIENT"
            }
          ],
          "item_evidence_sufficiency": "SUFFICIENT",
          "positive_evidence": [
            {
              "evidence_id": "human_preference_case_a_thinking.problem_reframing",
              "quote": "human_preference source artifact contains this case module and reviewer replay evidence.",
              "location": "human_preference/case_a/thinking.problem_reframing",
              "supports_what": "supports replay scoring for this item",
              "evidence_sufficiency": "SUFFICIENT"
            }
          ],
          "missing_evidence": [],
          "deduction_reason": "",
          "why_not_higher": "",
          "repair_action": "",
          "decision": "PASS"
        },
        {
          "item_id": "thinking.eightq_reasoning_validity",
          "level": "S",
          "primary_account": "thinking_depth",
          "max_score": 6,
          "raw_score": 6,
          "caps_applied": [],
          "capped_score": 6,
          "deductions_applied": [],
          "adjusted_score": 6,
          "final_score": 6,
          "anchor_matched": "6分 replay anchor",
          "required_evidence_points": [
            {
              "point": "human_preference case_a replay evidence point",
              "support_level": "SUFFICIENT"
            }
          ],
          "item_evidence_sufficiency": "SUFFICIENT",
          "positive_evidence": [
            {
              "evidence_id": "human_preference_case_a_thinking.eightq_reasoning_validity",
              "quote": "human_preference source artifact contains this case module and reviewer replay evidence.",
              "location": "human_preference/case_a/thinking.eightq_reasoning_validity",
              "supports_what": "supports replay scoring for this item",
              "evidence_sufficiency": "SUFFICIENT"
            }
          ],
          "missing_evidence": [],
          "deduction_reason": "",
          "why_not_higher": "",
          "repair_action": "",
          "decision": "PASS"
        },
        {
          "item_id": "thinking.causal_mechanism",
          "level": "S",
          "primary_account": "thinking_depth",
          "max_score": 7,
          "raw_score": 7,
          "caps_applied": [],
          "capped_score": 7,
          "deductions_applied": [],
          "adjusted_score": 7,
          "final_score": 7,
          "anchor_matched": "7分 replay anchor",
          "required_evidence_points": [
            {
              "point": "human_preference case_a replay evidence point",
              "support_level": "SUFFICIENT"
            }
          ],
          "item_evidence_sufficiency": "SUFFICIENT",
          "positive_evidence": [
            {
              "evidence_id": "human_preference_case_a_thinking.causal_mechanism",
              "quote": "human_preference source artifact contains this case module and reviewer replay evidence.",
              "location": "human_preference/case_a/thinking.causal_mechanism",
              "supports_what": "supports replay scoring for this item",
              "evidence_sufficiency": "SUFFICIENT"
            }
          ],
          "missing_evidence": [],
          "deduction_reason": "",
          "why_not_higher": "",
          "repair_action": "",
          "decision": "PASS"
        },
        {
          "item_id": "thinking.system_relation_value_flow",
          "level": "A",
          "primary_account": "thinking_depth",
          "max_score": 5,
          "raw_score": 5,
          "caps_applied": [],
          "capped_score": 5,
          "deductions_applied": [],
          "adjusted_score": 5,
          "final_score": 5,
          "anchor_matched": "5分 replay anchor",
          "required_evidence_points": [
            {
              "point": "human_preference case_a replay evidence point",
              "support_level": "SUFFICIENT"
            }
          ],
          "item_evidence_sufficiency": "SUFFICIENT",
          "positive_evidence": [
            {
              "evidence_id": "human_preference_case_a_thinking.system_relation_value_flow",
              "quote": "human_preference source artifact contains this case module and reviewer replay evidence.",
              "location": "human_preference/case_a/thinking.system_relation_value_flow",
              "supports_what": "supports replay scoring for this item",
              "evidence_sufficiency": "SUFFICIENT"
            }
          ],
          "missing_evidence": [],
          "deduction_reason": "",
          "why_not_higher": "",
          "repair_action": "",
          "decision": "PASS"
        },
        {
          "item_id": "thinking.counterfactual_boundary",
          "level": "A",
          "primary_account": "thinking_depth",
          "max_score": 5,
          "raw_score": 5,
          "caps_applied": [],
          "capped_score": 5,
          "deductions_applied": [],
          "adjusted_score": 5,
          "final_score": 5,
          "anchor_matched": "5分 replay anchor",
          "required_evidence_points": [
            {
              "point": "human_preference case_a replay evidence point",
              "support_level": "SUFFICIENT"
            }
          ],
          "item_evidence_sufficiency": "SUFFICIENT",
          "positive_evidence": [
            {
              "evidence_id": "human_preference_case_a_thinking.counterfactual_boundary",
              "quote": "human_preference source artifact contains this case module and reviewer replay evidence.",
              "location": "human_preference/case_a/thinking.counterfactual_boundary",
              "supports_what": "supports replay scoring for this item",
              "evidence_sufficiency": "SUFFICIENT"
            }
          ],
          "missing_evidence": [],
          "deduction_reason": "",
          "why_not_higher": "",
          "repair_action": "",
          "decision": "PASS"
        },
        {
          "item_id": "thinking.trend_projection",
          "level": "A",
          "primary_account": "thinking_depth",
          "max_score": 4,
          "raw_score": 4,
          "caps_applied": [],
          "capped_score": 4,
          "deductions_applied": [],
          "adjusted_score": 4,
          "final_score": 4,
          "anchor_matched": "4分 replay anchor",
          "required_evidence_points": [
            {
              "point": "human_preference case_a replay evidence point",
              "support_level": "SUFFICIENT"
            }
          ],